{
  "artifact_directory": "reports/daily/2026/08/21/aiq-20260821-r19",
  "assignments": [
    {
      "agent_id": "aiq-001-weather",
      "agent_name": "aiq-001-weather-20260821-r19-w00",
      "agent_type": "prompt",
      "agent_version_digest": "sha256:7ac7de8086f70d776113f77fa3d1dea83ddbc9fae202d80659058265777ea0cc",
      "conflict_tags": [
        "healthy-control"
      ],
      "expected": {
        "category": "none",
        "finding_count": 0,
        "severity": "none",
        "validation_targets": [
          "no_insight",
          "evidence"
        ]
      },
      "family": "healthy_controls",
      "lifecycle": "current_immutable_version",
      "run_id": "run-00-aiq-001-weather",
      "scenario_id": "aiq-scn-002-expected-model-latency",
      "scenario_version": "1.0.0",
      "selection_reason": "healthy_control_daily",
      "traffic_recipe_id": "traffic-expected-model-latency-v1",
      "traffic_requests": 3,
      "traffic_seed": 5547464175774310204,
      "traffic_seed_namespace": "expected-model-latency-v1",
      "version_sequence": [
        {
          "digest": "sha256:7ac7de8086f70d776113f77fa3d1dea83ddbc9fae202d80659058265777ea0cc",
          "phase": "healthy",
          "version_key": "healthy",
          "window": {
            "end": "window://run-00-aiq-001-weather/healthy/end-exclusive",
            "start": "window://run-00-aiq-001-weather/healthy/start-inclusive"
          }
        }
      ],
      "wave": 0,
      "window": {
        "end": "window://run-00-aiq-001-weather/healthy/end-exclusive",
        "start": "window://run-00-aiq-001-weather/healthy/start-inclusive"
      }
    },
    {
      "agent_id": "aiq-002-healthcare",
      "agent_name": "aiq-002-healthcare-20260821-r19-w00",
      "agent_type": "prompt",
      "agent_version_digest": "sha256:d457eddb91f0755ef203884e2811aeb6fc35ca3fcca974950a200c5032076240",
      "conflict_tags": [
        "trace-root"
      ],
      "expected": {
        "category": "none",
        "finding_count": 0,
        "severity": "none",
        "validation_targets": [
          "no_insight",
          "evidence"
        ]
      },
      "family": "trace_interpretation",
      "lifecycle": "current_immutable_version",
      "run_id": "run-00-aiq-002-healthcare",
      "scenario_id": "aiq-scn-057-handled-child-failure-control",
      "scenario_version": "1.0.0",
      "selection_reason": "healthy_control_daily",
      "traffic_recipe_id": "traffic-handled-child-failure-control-v1",
      "traffic_requests": 4,
      "traffic_seed": 17616244772330148061,
      "traffic_seed_namespace": "handled-child-failure-control-v1",
      "version_sequence": [
        {
          "digest": "sha256:d457eddb91f0755ef203884e2811aeb6fc35ca3fcca974950a200c5032076240",
          "phase": "healthy",
          "version_key": "healthy",
          "window": {
            "end": "window://run-00-aiq-002-healthcare/healthy/end-exclusive",
            "start": "window://run-00-aiq-002-healthcare/healthy/start-inclusive"
          }
        }
      ],
      "wave": 0,
      "window": {
        "end": "window://run-00-aiq-002-healthcare/healthy/end-exclusive",
        "start": "window://run-00-aiq-002-healthcare/healthy/start-inclusive"
      }
    },
    {
      "agent_id": "aiq-003-finance",
      "agent_name": "aiq-003-finance-20260821-r19-w00",
      "agent_type": "hosted_code",
      "agent_version_digest": "sha256:9401aa367fdd63ca1dbf7a42f9ebad87e47bf3b2e9f97e620243ba09ef4107b5",
      "conflict_tags": [
        "healthy-control"
      ],
      "expected": {
        "category": "none",
        "finding_count": 0,
        "severity": "none",
        "validation_targets": [
          "no_insight",
          "evidence"
        ]
      },
      "family": "healthy_controls",
      "lifecycle": "current_immutable_version",
      "run_id": "run-00-aiq-003-finance",
      "scenario_id": "aiq-scn-003-handled-transient-failure",
      "scenario_version": "1.0.0",
      "selection_reason": "healthy_control_daily",
      "traffic_recipe_id": "traffic-handled-transient-failure-v1",
      "traffic_requests": 4,
      "traffic_seed": 4939821934759764589,
      "traffic_seed_namespace": "handled-transient-failure-v1",
      "version_sequence": [
        {
          "digest": "sha256:9401aa367fdd63ca1dbf7a42f9ebad87e47bf3b2e9f97e620243ba09ef4107b5",
          "phase": "healthy",
          "version_key": "healthy",
          "window": {
            "end": "window://run-00-aiq-003-finance/healthy/end-exclusive",
            "start": "window://run-00-aiq-003-finance/healthy/start-inclusive"
          }
        }
      ],
      "wave": 0,
      "window": {
        "end": "window://run-00-aiq-003-finance/healthy/end-exclusive",
        "start": "window://run-00-aiq-003-finance/healthy/start-inclusive"
      }
    },
    {
      "agent_id": "aiq-003-finance",
      "agent_name": "aiq-003-finance-20260821-r19-w00",
      "agent_type": "hosted_code",
      "agent_version_digest": "sha256:9401aa367fdd63ca1dbf7a42f9ebad87e47bf3b2e9f97e620243ba09ef4107b5",
      "conflict_tags": [
        "trace-root"
      ],
      "expected": {
        "category": "none",
        "finding_count": 0,
        "severity": "none",
        "validation_targets": [
          "no_insight",
          "evidence"
        ]
      },
      "family": "trace_interpretation",
      "lifecycle": "current_immutable_version",
      "run_id": "run-00-aiq-003-finance",
      "scenario_id": "aiq-scn-056-outer-zero-token-control",
      "scenario_version": "1.0.0",
      "selection_reason": "healthy_control_daily",
      "traffic_recipe_id": "traffic-outer-zero-token-control-v1",
      "traffic_requests": 4,
      "traffic_seed": 2247478531379119715,
      "traffic_seed_namespace": "outer-zero-token-control-v1",
      "version_sequence": [
        {
          "digest": "sha256:9401aa367fdd63ca1dbf7a42f9ebad87e47bf3b2e9f97e620243ba09ef4107b5",
          "phase": "healthy",
          "version_key": "healthy",
          "window": {
            "end": "window://run-00-aiq-003-finance/healthy/end-exclusive",
            "start": "window://run-00-aiq-003-finance/healthy/start-inclusive"
          }
        }
      ],
      "wave": 0,
      "window": {
        "end": "window://run-00-aiq-003-finance/healthy/end-exclusive",
        "start": "window://run-00-aiq-003-finance/healthy/start-inclusive"
      }
    },
    {
      "agent_id": "aiq-004-travel",
      "agent_name": "aiq-004-travel-20260821-r19-w00",
      "agent_type": "hosted_code",
      "agent_version_digest": "sha256:363c97d53efd3c5674e926a9bc257e423c6cdfa3ed8dac4188093e52f92ec366",
      "conflict_tags": [
        "healthy-control"
      ],
      "expected": {
        "category": "none",
        "finding_count": 0,
        "severity": "none",
        "validation_targets": [
          "no_insight",
          "evidence"
        ]
      },
      "family": "healthy_controls",
      "lifecycle": "current_immutable_version",
      "run_id": "run-00-aiq-004-travel",
      "scenario_id": "aiq-scn-001-fully-healthy",
      "scenario_version": "1.0.0",
      "selection_reason": "healthy_control_daily",
      "traffic_recipe_id": "traffic-fully-healthy-v1",
      "traffic_requests": 3,
      "traffic_seed": 14777516499712475503,
      "traffic_seed_namespace": "fully-healthy-v1",
      "version_sequence": [
        {
          "digest": "sha256:363c97d53efd3c5674e926a9bc257e423c6cdfa3ed8dac4188093e52f92ec366",
          "phase": "healthy",
          "version_key": "healthy",
          "window": {
            "end": "window://run-00-aiq-004-travel/healthy/end-exclusive",
            "start": "window://run-00-aiq-004-travel/healthy/start-inclusive"
          }
        }
      ],
      "wave": 0,
      "window": {
        "end": "window://run-00-aiq-004-travel/healthy/end-exclusive",
        "start": "window://run-00-aiq-004-travel/healthy/start-inclusive"
      }
    },
    {
      "agent_id": "aiq-005-ticket",
      "agent_name": "aiq-005-ticket-20260821-r19-w00",
      "agent_type": "hosted_custom_container",
      "agent_version_digest": "sha256:09d6478f8fcdd0919749fbd3ecbbfadd7d967b646c8e2a35fdc850109ca756ad",
      "conflict_tags": [
        "healthy-control"
      ],
      "expected": {
        "category": "none",
        "finding_count": 0,
        "severity": "none",
        "validation_targets": [
          "no_insight",
          "evidence"
        ]
      },
      "family": "healthy_controls",
      "lifecycle": "current_immutable_version",
      "run_id": "run-00-aiq-005-ticket",
      "scenario_id": "aiq-scn-004-ordinary-token-use",
      "scenario_version": "1.0.0",
      "selection_reason": "healthy_control_daily",
      "traffic_recipe_id": "traffic-ordinary-token-use-v1",
      "traffic_requests": 3,
      "traffic_seed": 5586176393153128507,
      "traffic_seed_namespace": "ordinary-token-use-v1",
      "version_sequence": [
        {
          "digest": "sha256:09d6478f8fcdd0919749fbd3ecbbfadd7d967b646c8e2a35fdc850109ca756ad",
          "phase": "healthy",
          "version_key": "healthy",
          "window": {
            "end": "window://run-00-aiq-005-ticket/healthy/end-exclusive",
            "start": "window://run-00-aiq-005-ticket/healthy/start-inclusive"
          }
        }
      ],
      "wave": 0,
      "window": {
        "end": "window://run-00-aiq-005-ticket/healthy/end-exclusive",
        "start": "window://run-00-aiq-005-ticket/healthy/start-inclusive"
      }
    },
    {
      "agent_id": "aiq-001-weather",
      "agent_name": "aiq-001-weather-20260821-r19-w01",
      "agent_type": "prompt",
      "agent_version_digest": "sha256:f8aae81a984f8daa97bd415c07d253a434b8122171acbb265e0c5fc9182d2e36",
      "conflict_tags": [
        "grounding-root"
      ],
      "expected": {
        "category": "hallucinations",
        "finding_count": 1,
        "severity": "high",
        "validation_targets": [
          "root_cause",